{
  "$schema": "../agent-schema.json",
  "name": "comment-analyzer",
  "description": "Audits code comments for accuracy, completeness, and long-term maintainability. Cross-references every claim in a comment against the actual code to catch stale or misleading documentation. Advisory only — does not modify code.",
  "prompt": "file://./prompts/comment-analyzer.md",
  "tools": ["fs_read", "execute_bash", "grep", "code", "glob"],
  "allowedTools": ["fs_read", "execute_bash", "grep", "code", "glob"],
  "resources": [
    "file://AGENTS.md",
    "file://CLAUDE.md",
    "file://.editorconfig",
    "file://.kiro/steering/*.md",
    "skill://.kiro/skills/**/SKILL.md"
  ]
}
